question,postID,votes,answers,views
"What does the ""yield"" keyword do?",231767,12447,51,3.1m
"What does if __name__ == ""__main__"": do?",419163,7867,43,4.3m
Does Python have a ternary conditional operator?,394809,7586,30,2.7m
What are metaclasses in Python?,100003,7074,23,1.1m
How do I check whether a file exists without exceptions?,82831,6861,40,5.1m
How do I merge two dictionaries in a single expression?,38987,6564,43,3.0m
How do I execute a program or call a system command?,89228,5871,64,4.2m
How can I safely create a nested directory?,273192,5406,28,3.5m
Accessing the index in 'for' loops,522563,4979,26,3.6m
How do I make a flat list out of a list of lists?,952914,4967,34,3.7m
Difference between @staticmethod and @classmethod,136097,4462,35,1.0m
Understanding slicing,509211,4409,36,2.8m
Finding the index of an item in a list,176918,4215,42,5.7m
Iterating over dictionaries using 'for' loops,3294889,4066,15,5.4m
Using global variables in a function,423379,3798,25,3.9m
How to iterate over rows in a DataFrame in Pandas,16476924,3712,31,6.0m
How do I get the current time?,415511,3655,53,4.0m
Catch multiple exceptions in one line (except block),6470428,3633,6,1.3m
Does Python have a string 'contains' substring method?,3437059,3588,10,6.3m
What is the difference between __str__ and __repr__?,1436703,3530,28,909k
Convert bytes to a string,606191,3527,23,4.5m
How to copy files,123198,3494,25,3.1m
How do I list all files of a directory?,3207219,3467,21,7.4m
What is __init__.py for?,448271,3423,14,2.0m
How do I sort a dictionary by value?,613183,3416,34,4.9m
How can I add new keys to a dictionary?,1024847,3411,19,5.1m
"""Least Astonishment"" and the Mutable Default Argument",1132941,3258,32,236k
How do I concatenate two lists in Python?,1720421,3245,31,4.0m
How do I select rows from a DataFrame based on column values?,17071871,3234,16,5.4m
How do I check if a list is empty?,53513,3229,27,4.4m
What does ** (double star/asterisk) and * (star/asterisk) do for parameters?,36901,3199,25,1.2m
How do I pass a variable by reference?,986006,3180,39,1.9m
How do I clone a list so that it doesn't change unexpectedly after assignment?,2612802,3173,23,2.1m
How do I make a time delay? [duplicate],510348,3134,13,3.6m
How can I delete a file or folder in Python?,6996603,3117,15,3.0m
What is the difference between Python's list methods append and extend?,252703,3113,20,3.2m
Understanding Python super() with __init__() methods [duplicate],576169,3108,7,2.4m
How to make function decorators and chain them together?,739654,3086,20,625k
How do I change the size of figures drawn with Matplotlib?,332289,3063,13,5.5m
Manually raising (throwing) an exception in Python,2052390,3025,11,2.7m
How do I print colored text to the terminal?,287871,2970,63,2.1m
How do I split a list into equally-sized chunks?,312443,2961,72,1.5m
How can I access environment variables in Python?,4906977,2951,15,2.6m
"Convert string ""Jun 1 2005 1:33PM"" into datetime",466345,2878,26,4.4m
"Why is ""1000000000000000 in range(1000000000000001)"" so fast in Python 3?",30081275,2854,12,330k
Find the current directory and file's directory [duplicate],5137497,2849,13,4.3m
Renaming column names in Pandas,11346283,2747,35,5.4m
How can I remove a key from a Python dictionary?,11277432,2706,11,2.5m
Check if a given key already exists in a dictionary,1602934,2679,16,5.8m
How do I parse a string to a float or int?,379906,2668,32,4.6m
How do I get the last element of a list?,930397,2658,25,2.9m
How do I sort a list of dictionaries by a value of the dictionary?,72899,2627,19,1.2m
How to upgrade all Python packages with pip?,2720014,2607,54,1.7m
How do I get a substring of a string in Python?,663171,2574,16,3.6m
How do I lowercase a string in Python?,6797984,2473,5,3.0m
Class (static) variables and methods,68645,2451,27,1.6m
How to print without a newline or space,493386,2329,25,2.4m
How to leave/exit/deactivate a Python virtualenv,990754,2314,14,1.8m
Calling a function of a module by using its name (a string),3061,2311,18,1.0m
Importing files from different folder,4383571,2297,37,2.9m
How do I check if an object has an attribute?,610883,2294,16,1.3m
How can I randomly select an item from a list?,306400,2267,17,2.0m
How do I print curly-brace characters in a string while using .format?,5466451,2255,23,851k
Limiting floats to two decimal points,455612,2231,34,4.9m
How do I get the number of elements in a list (length of a list) in Python?,1712227,2215,12,3.7m
Why is reading lines from stdin much slower in C++ than Python?,9371238,2129,10,303k
How to remove an element from a list by index,627435,2123,18,3.7m
Is there a way to run Python on Android?,101754,2085,23,736k
Determine the type of an object? [duplicate],2225038,2081,15,2.1m
How do I count the occurrences of a list item?,2600191,2070,29,2.7m
How to determine a Python variable's type?,402504,2070,21,3.6m
Delete a column from a Pandas DataFrame,13411544,2051,20,3.4m
Delete an element from a dictionary,5844672,2042,18,2.5m
Why is it string.join(list) instead of list.join(string)?,493819,2034,11,1.4m
How to read a file line-by-line into a list?,3277503,2025,28,4.6m
How do I pad a string with zeroes?,339007,1995,19,1.4m
How to check if the string is empty?,9573244,1988,25,2.8m
How can I remove a trailing newline?,275018,1967,27,2.3m
How do I append to a file?,4706499,1963,13,2.0m
Static methods in Python?,735975,1963,12,1.2m
How do I measure elapsed time in Python?,7370801,1914,41,2.4m
How do I check if a string represents a number (float or int)?,354038,1892,39,1.6m
"What is the difference between venv, pyvenv, pyenv, virtualenv, virtualenvwrapper, pipenv, etc?",41573587,1882,7,498k
Getting the class name of an instance,510972,1867,12,1.4m
How do I split the definition of a long string over multiple lines?,10660435,1854,30,1.8m
Meaning of @classmethod and @staticmethod for beginner [duplicate],12179271,1852,12,750k
Installing specific package version with pip,5226311,1809,12,2.2m
Generate random integers between 0 and 9,3996904,1798,22,2.6m
How to prettyprint a JSON file?,12943819,1768,16,2.0m
What's the canonical way to check for type in Python?,152580,1750,13,1.3m
Extracting extension from filename in Python,541390,1727,32,1.4m
How do I read from stdin?,1450393,1719,24,2.1m
Replacements for switch statement in Python?,60208,1717,44,2.2m
What is the meaning of single and double underscore before an object name?,1301346,1715,18,664k
How do I get the row count of a Pandas DataFrame?,15943769,1713,17,3.7m
Proper way to declare custom exceptions in modern Python?,1319615,1708,15,951k
fatal error: Python.h: No such file or directory,21530577,1701,35,1.5m
How do I print to stderr in Python?,5574702,1689,17,1.2m
Random string generation with upper case letters and digits,2257441,1674,36,1.3m
How do I install pip on macOS or OS X?,17271319,1672,21,2.8m
How can I import a module dynamically given the full path?,67631,1664,35,1.3m
How can I make a dictionary (dict) from separate lists of keys and values?,209840,1656,21,1.2m
Selecting multiple columns in a Pandas dataframe,11285613,1633,22,3.6m
Why do Python classes inherit object?,4015417,1618,6,416k
How do I profile a Python script?,582336,1617,33,760k
How can I install packages using pip according to the requirements.txt file from a local directory?,7225900,1606,18,2.3m
Save plot to image file instead of displaying it using Matplotlib,9622163,1606,24,2.5m
How do I reverse a string in Python?,931092,1601,18,1.6m
How do I write JSON data to a file?,12309269,1592,16,2.3m
How do I get time of a Python program's execution?,1557571,1590,38,2.2m
"What is the Python 3 equivalent of ""python -m SimpleHTTPServer""",7943751,1585,7,770k
Convert integer to string in Python,961632,1555,13,3.7m
Use different Python version with virtualenv,1534210,1549,41,1.5m
How do I get the filename without the extension from a path in Python?,678236,1548,30,1.9m
What does __all__ mean in Python?,44834,1535,10,524k
Use of *args and **kwargs [duplicate],3394835,1532,11,907k
How can I flush the output of the print function?,230751,1531,13,1.0m
Creating a singleton in Python,6760685,1531,38,604k
if/else in a list comprehension,4260280,1529,12,1.6m
Create a dictionary with comprehension,1747817,1516,17,1.1m
How can I check for NaN values?,944700,1504,18,2.4m
Why can't Python parse this JSON data? [closed],2835559,1504,3,2.7m
What are the differences between type() and isinstance()?,1549801,1501,8,837k
Relative imports for the billionth time,14132789,1491,12,482k
How to change the order of DataFrame columns?,13148429,1487,41,2.1m
How do I check if directory exists in Python?,8933237,1484,15,1.4m
How to put the legend outside the plot,4700614,1476,17,1.5m
How can I use threading in Python?,2846653,1469,22,1.1m
UnicodeEncodeError: 'ascii' codec can't encode character u'\xa0' in position 20: ordinal not in range(128),9942594,1466,34,2.1m
What is setup.py?,1471994,1462,10,979k
Relative imports in Python 3,16981921,1454,31,1.4m
String formatting: % vs. .format vs. f-string literal,5082452,1436,16,1.0m
Null object in Python,3289601,1427,9,2.2m
How do I check which version of Python is running my script?,1093322,1426,25,1.8m
Hidden features of Python [closed],101268,1416,191,717k
How do I sort a dictionary by key?,9001509,1401,32,2.0m
"What is the use of ""assert"" in Python?",5142418,1401,23,1.2m
Is there a built-in function to print all the current properties and values of an object?,192109,1394,30,1.2m
Change column type in pandas,15891038,1387,15,3.2m
Removing duplicates in lists,7961363,1377,56,2.0m
Best way to convert string to bytes in Python 3?,7585435,1377,5,2.4m
How do I create multiline comments in Python?,7696924,1371,27,1.9m
"In Python, how do I determine if an object is iterable?",1952464,1357,23,681k
How to move a file in Python?,8858008,1356,11,1.7m
How do I trim whitespace from a string?,761804,1343,13,1.4m
How do I get the full path of the current file's directory?,3430372,1342,10,2.2m
How to copy a dictionary and only edit the copy,2465921,1332,22,1.0m
How do I terminate a script?,73663,1325,13,1.9m
How to drop rows of Pandas DataFrame whose value in a certain column is NaN,13413590,1321,15,1.8m
How can I do a line break (line continuation) in Python?,53162,1320,10,2.2m
Getting key with maximum value in dictionary?,268272,1318,29,1.4m
How do I create a constant in Python?,2682745,1315,44,1.3m
Display number with leading zeros,134934,1313,19,1.3m
How do I find the location of my Python site-packages directory?,122327,1312,22,1.4m
Correct way to write line to file?,6159900,1310,16,2.6m
pg_config executable not found,11618898,1307,54,1.1m
Running shell command and capturing the output,4760215,1307,21,1.6m
Create a Pandas Dataframe by appending one row at a time,10715965,1302,31,2.1m
Get a list from Pandas DataFrame column headers,19482970,1301,23,2.1m
Why do people write #!/usr/bin/env python on the first line of a Python script?,2429511,1301,22,959k
How do I reverse a list or loop over it backwards?,3940128,1300,37,1.9m
Why does comparing strings using either '==' or 'is' sometimes produce a different result?,1504717,1295,15,1.6m
How do I check if a variable exists?,843277,1294,14,1.5m
What is the purpose of the `self` parameter? Why is it needed?,2709821,1291,26,991k
How to read a text file into a string variable and strip newlines?,8369219,1289,27,2.1m
What is the difference between null=True and blank=True in Django?,8609192,1288,28,454k
How does the @property decorator work in Python?,17330160,1285,15,691k
How to deal with SettingWithCopyWarning in Pandas,20625582,1277,20,1.8m
How to add a new column to an existing DataFrame?,12555323,1272,32,2.6m
"If Python is interpreted, what are .pyc files?",2998215,1270,12,620k
What does the 'b' character do in front of a string literal?,6269765,1270,11,1.0m
What is a mixin and why is it useful?,533631,1269,18,448k
How to catch and print the full exception traceback without halting/exiting the program?,3702675,1263,18,1.2m
Putting a simple if-then-else statement on one line [duplicate],2802726,1260,5,2.2m
How to get the ASCII value of a character,227459,1257,5,1.6m
How to make a class JSON serializable,3768895,1254,40,1.3m
How do I connect to a MySQL Database in Python?,372885,1254,26,1.4m
How to get line count of a large file cheaply in Python?,845058,1250,44,1.1m
How does Python's super() work with multiple inheritance?,3277367,1250,18,533k
How do I print an exception in Python?,1483429,1247,11,1.6m
How do I get file creation and modification date/times?,237079,1239,12,1.1m
Count the number of occurrences of a character in a string,1155617,1223,25,1.5m
"How to overcome ""datetime.datetime not JSON serializable""?",11875770,1221,34,982k
Does Django scale? [closed],886221,1217,29,207k
"Extract file name from path, no matter what the os/path format",8384737,1212,22,1.9m
How to return dictionary keys as a list in Python?,16819222,1212,12,1.8m
Alternatives for returning multiple values from a Python function [closed],354883,1212,14,1.4m
Use a list of values to select rows from a Pandas dataframe,12096252,1204,8,1.4m
How do I iterate through two lists in parallel?,1663807,1195,8,1.1m
How do I trim whitespace?,1185524,1194,15,1.2m
How do I get a list of locally installed Python modules?,739993,1184,33,1.6m
Fastest way to check if a value exists in a list,7571635,1182,12,2.8m
"Difference between del, remove, and pop on lists",11520492,1177,14,2.0m
Get difference between two lists with Unique Entries,3462143,1176,31,1.4m
"""Large data"" workflows using pandas [closed]",14262433,1172,16,346k
Get the data received in a Flask request,10434599,1166,23,1.6m
Remove all whitespace in a string,8270092,1163,14,2.5m
How do I install a Python package with a .whl file?,27885397,1155,18,2.1m
Is there a simple way to delete a list element by value?,2793324,1152,25,1.9m
How do I import other Python files?,2349991,1150,23,2.5m
"Should I put #! (shebang) in Python scripts, and what form should it take?",6908143,1149,15,788k
How do you test that a Python function throws an exception?,129507,1147,19,771k
"What are ""named tuples"" in Python?",2970608,1145,13,577k
How to parse XML and get instances of a particular node attribute?,1912434,1142,18,1.5m
How can I represent an 'Enum' in Python?,36932,1141,43,1.2m
What is a cross-platform way to get the home directory?,4028904,1140,5,616k
Get unique values from a list in python [duplicate],12897374,1139,30,2.5m
Usage of __slots__?,472000,1136,14,334k
What's the difference between lists and tuples?,626759,1136,23,449k
Maximum and Minimum values for ints,7604966,1135,9,1.7m
How to sort a list of objects based on an attribute of the objects?,403421,1135,8,837k
What are the most common Python docstring formats? [closed],3898572,1135,6,592k
Converting from a string to boolean in Python,715417,1116,39,1.1m
How to convert list to string [duplicate],5618878,1116,3,3.4m
What is the difference between old style and new style classes in Python?,54867,1114,8,264k
Pretty-print an entire Pandas Series / DataFrame,19124601,1105,14,1.2m
How to print a number using commas as thousands separators,1823058,1098,30,773k
Checking whether a variable is an integer or not [duplicate],3501382,1094,41,1.8m
How to subtract a day from a date?,441147,1090,7,1.0m
Convert a String representation of a Dictionary to a dictionary,988228,1089,11,1.3m
Converting unix timestamp string to readable date,3682748,1086,19,1.5m
Convert list of dictionaries to a pandas DataFrame,20638006,1085,7,774k
Should I use 'has_key()' or 'in' on Python dicts?,1323410,1081,9,829k
How do I type hint a method with the type of the enclosing class?,33533148,1080,7,225k
What is the easiest way to remove all packages installed by pip?,11248073,1079,31,1.0m
How to create a GUID/UUID in Python,534839,1078,9,903k
How to download a file over HTTP?,22676,1076,30,1.4m
How do I check file size in Python?,2104080,1064,10,944k
List comprehension vs. lambda + filter,3013449,1061,17,795k
How do I remove/delete a folder that is not empty?,303200,1055,22,909k
How to emulate a do-while loop?,743164,1054,20,1.7m
How to concatenate (join) items in a list to a single string,12453580,1052,11,1.9m
How do I unload (reload) a Python module?,437589,1045,22,848k
How to set environment variables in Python?,5971312,1044,19,1.5m
Find all files in a directory with extension .txt in Python,3964681,1041,25,2.6m
Find which version of package is installed with pip,10214827,1040,16,1.1m
How can I write a `try`/`except` block that catches all exceptions?,4990718,1038,10,1.0m
Python's equivalent of && (logical-and) in an if-statement,2485466,1027,9,2.7m
Writing a pandas DataFrame to CSV file,16923281,1026,9,2.1m
What IDE to use for Python? [closed],81584,1025,1,1.7m
Why dict.get(key) instead of dict[key]?,11041405,1018,14,824k
How to retrieve a module's path?,247770,1017,23,994k
What is the difference between pip and conda?,20994716,1015,14,479k
pip install from git repo branch,20101834,1013,8,700k
Behaviour of increment and decrement operators in Python,1485841,1013,11,1.4m
How to get a function name as a string?,251464,1009,14,766k
What is the naming convention in Python for variable and function?,159720,1004,15,692k
How do I remove the first item from a list?,4426663,1003,12,1.2m
How to POST JSON data with Python Requests?,9733638,1002,10,1.5m
Traverse a list in reverse order in Python [duplicate],529424,998,28,1.1m
