question,postID,votes,answers,views
How do I authenticate client application using spring authorization server 1.0.0?,74702795,0,0,5
Protecting response manipulation in mern stack,74702794,0,0,7
Objetos no Javascript [closed],74702792,-1,0,16
Given a character of the alphabet I want to compute and print an integer value as a result,74702786,0,2,24
Replace text with php,74702784,-1,0,19
Store and retreive RSA private key in Windows,74702782,0,0,8
How to be able to connect to MariaDB docker container at localhost:3306 from Python application running in another container?,74702780,0,0,7
How to send activity output as email attachment in logic app,74702778,0,0,6
Why is Turbo Action Cable within a job not working in system Rspec tests?,74702773,0,0,8
Print pascals triangle when number of rows are inputted,74702772,0,0,12
Latitude is not scaling the same way as longitude when plot on thunderforest/ openstreet map,74702771,0,0,5
Xcode on Real Device Developer Mood disable,74702770,0,1,8
Shopify get all shipping rates,74702769,0,0,6
mongodb find documents with arrays not having any item from outer array,74702767,0,0,7
What's the right form of writing a query that selects two columns from two different tables yet mentioning just one after the 'FROM' clause,74702764,0,0,9
Group datetime column based on the time difference,74702759,0,1,13
Multithreading but first few threads are being skipped,74702758,0,0,7
Is is possible to subscribe to alarms with a OPC UA client?,74702757,0,0,8
How can I retrive the most represented value in coolumn of a dataframe?,74702756,0,1,10
Count records from two tables with foreign keys,74702755,0,2,13
Fastapi request form not displaying example,74702754,0,0,7
Compare two lists on a condition and add to another list,74702751,0,0,15
Scipy.ndimage.rotate on 3D image gives a different result if spline_filter is applied before,74702750,0,0,6
"Extracting sql file from phpmyadmin, to mySQL Workbench",74702749,-1,0,5
How can i make a change in two modules via Client Script/Custom Function in Zoho CRM,74702748,0,0,7
Is there any way to save the current state of kubernetes pod?,74702745,0,0,6
How to print the duration between two intervals in human recognizable way?,74702743,-1,0,20
How to remove equivalent elements in two different lists that are inside a tuple,74702742,0,0,10
ElasticSearch: translate sql to dsl; x_content_parse_exception error,74702740,0,0,5
How can I get query all news from first table and related to city from second? [closed],74702739,-1,0,12
Async SocketIO client emits only when sio.emit is called in the same function as the sio.connect is called in,74702737,0,0,6
SQLALchemy Many-to-Many with multiple same Objects,74702734,0,0,3
Migrating to latest react native firebase version,74702729,0,0,7
how to drop rows containing nans in several specified columns in R?,74702726,0,1,15
python: Create a multiindex pandas DF based on condition of column names,74702725,0,1,11
react-native app crashes on release mode - IOS with SIGABRT,74702724,0,0,7
php mailer doesn't work with info tld but works with com and couk,74702723,0,0,8
Check If Service Is Started With Espresso By Click On View,74702720,0,0,8
Javascript: show button depends on HTML radio buttons state,74702719,-1,0,15
How do I make a neura network classify an image to image using TensorFlow?,74702715,0,0,9
Error: During creation of MapperConfiguration,74702713,0,0,12
Script Macros for go to Last Row Google Sheet,74702711,0,0,5
Open url link from lambda for cache html in next js,74702710,0,0,9
Javascript/ variable place/ what is wrong with the code,74702709,0,2,36
"KAGGLE BERT : ValueError: Shapes (None, 2) and (None, 3) are incompatible",74702704,0,0,6
You have to build a dictionary (Or any other container of your choice) . Using python,74702702,0,0,7
How to solve R8 compilation compilation alarms：WARNING [closed],74702697,0,0,6
automatic creation venv and installing packages,74702693,0,0,7
Generate/copy SVG elements inside of SVG file and get them certain positions near origin elements,74702690,0,0,3
How do I check if a list contains a tuple in C#,74702688,1,3,31
